{
  "schema": 1,
  "id": 60,
  "code": "60-litoraneo-aviacao",
  "short": "60",
  "name": "Litorâneo / Aviação",
  "terminals": [
    "Litorâneo",
    "Aviação"
  ],
  "area_tags": [
    "Litorâneo",
    "Aviação"
  ],
  "is_active": true,
  "pilot": true,
  "schedules": [
    {
      "day_type": "weekday",
      "origin": "Litorâneo",
      "times": [
        "05:40",
        "06:20",
        "07:00",
        "07:50",
        "08:40",
        "09:30",
        "10:20",
        "11:10",
        "12:00",
        "12:50",
        "13:40",
        "14:30",
        "15:20",
        "16:10",
        "17:00",
        "17:50",
        "18:40",
        "20:20",
        "21:40",
        "23:00"
      ]
    },
    {
      "day_type": "weekday",
      "origin": "Aviação",
      "times": [
        "05:40",
        "06:20",
        "07:00",
        "07:50",
        "08:40",
        "09:30",
        "10:20",
        "11:10",
        "12:00",
        "12:50",
        "13:40",
        "14:30",
        "15:20",
        "16:10",
        "17:00",
        "17:50",
        "18:40",
        "19:30",
        "21:00",
        "22:30"
      ]
    },
    {
      "day_type": "saturday",
      "origin": "Litorâneo",
      "times": [
        "05:40",
        "06:20",
        "07:00",
        "07:50",
        "08:40",
        "09:30",
        "10:20",
        "11:10",
        "12:00",
        "12:50",
        "13:40",
        "14:20",
        "15:00",
        "15:40",
        "17:00",
        "18:20",
        "19:40",
        "21:00",
        "22:30"
      ]
    },
    {
      "day_type": "saturday",
      "origin": "Aviação",
      "times": [
        "05:40",
        "06:20",
        "07:00",
        "07:50",
        "08:40",
        "09:30",
        "10:20",
        "11:10",
        "12:00",
        "12:50",
        "13:40",
        "14:20",
        "15:00",
        "16:20",
        "17:40",
        "19:00",
        "20:20",
        "21:40",
        "23:10"
      ]
    },
    {
      "day_type": "sunday_holiday",
      "origin": "Litorâneo",
      "times": [
        "06:20",
        "07:40",
        "09:00",
        "10:20",
        "11:40",
        "13:00",
        "14:20",
        "15:40",
        "17:00",
        "18:20",
        "19:40",
        "21:00",
        "22:30"
      ]
    },
    {
      "day_type": "sunday_holiday",
      "origin": "Aviação",
      "times": [
        "05:40",
        "07:00",
        "08:20",
        "09:40",
        "11:00",
        "12:20",
        "13:40",
        "15:00",
        "16:20",
        "17:40",
        "19:00",
        "20:20",
        "21:40",
        "23:10"
      ]
    }
  ],
  "source_ids": [
    "onibus-online"
  ],
  "verified_at": null
}
