[{"schema":1,"id":10,"code":"10-aroeira-morada-do-ribeirao","short":"10","name":"Aroeira / Morada do Ribeirão","terminals":["Aroeira","Morada do Ribeirão"],"area_tags":["Aroeira","Morada do Ribeirão"],"is_active":true,"pilot":false,"schedules":[],"source_ids":["onibus-online"],"verified_at":null},{"schema":1,"id":12,"code":"12-aroeira-roberto-silvares","short":"12","name":"Aroeira / Roberto Silvares","terminals":["Aroeira","Roberto Silvares"],"area_tags":["Aroeira","Roberto Silvares"],"is_active":true,"pilot":false,"schedules":[],"source_ids":["onibus-online"],"verified_at":null},{"schema":1,"id":13,"code":"13-aroeira-cohab","short":"13","name":"Aroeira / Cohab","terminals":["Aroeira","Cohab"],"area_tags":["Aroeira","Cohab"],"is_active":true,"pilot":false,"schedules":[],"source_ids":["onibus-online"],"verified_at":null},{"schema":1,"id":20,"code":"20-santo-antonio-cohab","short":"20","name":"Santo Antônio / Cohab","terminals":["Santo Antônio","Cohab"],"area_tags":["Santo Antônio","Cohab"],"is_active":true,"pilot":false,"schedules":[],"source_ids":["onibus-online"],"verified_at":null},{"schema":1,"id":21,"code":"21-santo-antonio-aviacao","short":"21","name":"Santo Antônio / Aviação","terminals":["Santo Antônio","Aviação"],"area_tags":["Santo Antônio","Aviação"],"is_active":true,"pilot":false,"schedules":[],"source_ids":["onibus-online"],"verified_at":null},{"schema":1,"id":23,"code":"23-santo-antonio-guriri-expresso","short":"23","name":"Santo Antônio / Guriri / Expresso","terminals":["Santo Antônio","Guriri"],"area_tags":["Santo Antônio","Guriri"],"is_active":true,"pilot":false,"schedules":[],"source_ids":["onibus-online"],"verified_at":null},{"schema":1,"id":30,"code":"30-liberdade-morada-do-lago","short":"30","name":"Liberdade / Morada do Lago","terminals":["Liberdade","Morada do Lago"],"area_tags":["Liberdade","Morada do Lago"],"is_active":true,"pilot":false,"schedules":[],"source_ids":["onibus-online"],"verified_at":null},{"schema":1,"id":40,"code":"40-porto-cohab","short":"40","name":"Porto / Cohab","terminals":["Porto","Cohab"],"area_tags":["Porto","Cohab"],"is_active":true,"pilot":false,"schedules":[],"source_ids":["onibus-online"],"verified_at":null},{"schema":1,"id":41,"code":"41-santa-tereza-pedra-dagua","short":"41","name":"Santa Tereza / Pedra d'Água","terminals":["Santa Tereza","Pedra d'Água"],"area_tags":["Santa Tereza","Pedra d'Água"],"is_active":true,"pilot":false,"schedules":[],"source_ids":["onibus-online"],"verified_at":null},{"schema":1,"id":50,"code":"50-seac-alvorada","short":"50","name":"Seac / Alvorada","terminals":["Seac","Alvorada"],"area_tags":["Seac","Alvorada"],"is_active":true,"pilot":false,"schedules":[],"source_ids":["onibus-online"],"verified_at":null},{"schema":1,"id":51,"code":"51-bosque","short":"51","name":"Bosque","terminals":["Bosque"],"area_tags":["Bosque"],"is_active":true,"pilot":false,"schedules":[],"source_ids":["onibus-online"],"verified_at":null},{"schema":1,"id":60,"code":"60-litoraneo-aviacao","short":"60","name":"Litorâneo / Aviação","terminals":["Litorâneo","Aviação"],"area_tags":["Litorâneo","Aviação"],"is_active":true,"pilot":true,"schedules":[{"day_type":"weekday","origin":"Litorâneo","times":["05:40","06:20","07:00","07:50","08:40","09:30","10:20","11:10","12:00","12:50","13:40","14:30","15:20","16:10","17:00","17:50","18:40","20:20","21:40","23:00"]},{"day_type":"weekday","origin":"Aviação","times":["05:40","06:20","07:00","07:50","08:40","09:30","10:20","11:10","12:00","12:50","13:40","14:30","15:20","16:10","17:00","17:50","18:40","19:30","21:00","22:30"]},{"day_type":"saturday","origin":"Litorâneo","times":["05:40","06:20","07:00","07:50","08:40","09:30","10:20","11:10","12:00","12:50","13:40","14:20","15:00","15:40","17:00","18:20","19:40","21:00","22:30"]},{"day_type":"saturday","origin":"Aviação","times":["05:40","06:20","07:00","07:50","08:40","09:30","10:20","11:10","12:00","12:50","13:40","14:20","15:00","16:20","17:40","19:00","20:20","21:40","23:10"]},{"day_type":"sunday_holiday","origin":"Litorâneo","times":["06:20","07:40","09:00","10:20","11:40","13:00","14:20","15:40","17:00","18:20","19:40","21:00","22:30"]},{"day_type":"sunday_holiday","origin":"Aviação","times":["05:40","07:00","08:20","09:40","11:00","12:20","13:40","15:00","16:20","17:40","19:00","20:20","21:40","23:10"]}],"source_ids":["onibus-online"],"verified_at":null},{"schema":1,"id":62,"code":"62-guriri-ifes-ufes","short":"62","name":"Guriri / IFES / UFES","terminals":["Guriri","IFES / UFES"],"area_tags":["Guriri","IFES / UFES"],"is_active":true,"pilot":true,"schedules":[{"day_type":"weekday","origin":"Guriri","times":["06:00","07:40","11:40","12:10","12:15","13:30","17:20"]},{"day_type":"weekday","origin":"IFES / UFES","times":["12:40","16:20","18:35","21:00","22:40"]}],"source_ids":["onibus-online"],"verified_at":null},{"schema":1,"id":64,"code":"64-villages-roberto-silvares","short":"64","name":"Villages / Roberto Silvares","terminals":["Villages","Roberto Silvares"],"area_tags":["Villages","Roberto Silvares"],"is_active":true,"pilot":true,"schedules":[{"day_type":"weekday","origin":"Villages","times":["05:50","06:30","07:20","08:20","09:20","10:20","11:20","12:20","13:20","14:20","15:20","16:20","17:20","18:20","19:20","21:20"]},{"day_type":"weekday","origin":"Roberto Silvares","times":["06:30","07:20","08:20","09:20","10:20","11:20","12:20","13:20","14:20","15:20","16:20","17:20","18:20","19:20","20:20","21:10","22:30"]},{"day_type":"saturday","origin":"Villages","times":["05:50","06:30","07:20","08:20","09:20","10:20","11:20","12:20","13:20","15:20","17:20","19:20","21:20"]},{"day_type":"saturday","origin":"Roberto Silvares","times":["06:30","07:20","08:20","09:20","10:20","11:20","12:20","13:20","14:20","16:20","18:20","20:20","21:10","22:30"]},{"day_type":"sunday_holiday","origin":"Villages","times":["05:50","07:20","09:20","11:20","13:20","15:20","17:20","19:20","21:20"]},{"day_type":"sunday_holiday","origin":"Roberto Silvares","times":["06:30","08:20","10:20","12:20","14:20","16:20","18:20","20:20","22:30"]}],"source_ids":["onibus-online"],"verified_at":null},{"schema":1,"id":66,"code":"66-centro-ifes-ufes","short":"66","name":"Centro / IFES / UFES","terminals":["Centro","IFES / UFES"],"area_tags":["Centro","IFES / UFES"],"is_active":true,"pilot":true,"schedules":[{"day_type":"weekday","origin":"Centro","times":["06:40","07:20","08:00","08:40","09:20","10:00","10:40","11:20","12:00","12:40","13:20","14:00","14:40","15:20","16:00","16:40","17:20","18:00","18:40"]},{"day_type":"weekday","origin":"IFES / UFES","times":["07:20","08:00","08:40","09:20","10:00","10:40","11:20","12:00","12:40","13:20","13:50","14:40","15:20","16:00","16:40","17:20","18:00","18:40"]}],"source_ids":["onibus-online"],"verified_at":null},{"schema":1,"id":70,"code":"70-guriri-via-praiano","short":"70","name":"Guriri via Praiano","terminals":["Guriri","Praiano"],"area_tags":["Guriri","Praiano"],"is_active":true,"pilot":false,"schedules":[],"source_ids":["onibus-online"],"verified_at":null},{"schema":1,"id":71,"code":"71-norte-sul","short":"71","name":"Norte Sul","terminals":["Norte","Sul"],"area_tags":["Norte","Sul"],"is_active":true,"pilot":false,"schedules":[],"source_ids":["onibus-online"],"verified_at":null},{"schema":1,"id":81,"code":"81-paulista","short":"81","name":"Paulista","terminals":["Paulista"],"area_tags":["Paulista"],"is_active":true,"pilot":false,"schedules":[],"source_ids":["onibus-online"],"verified_at":null},{"schema":1,"id":90,"code":"90-porto-pedra-dagua","short":"90","name":"Porto / Pedra d'Água","terminals":["Porto","Pedra d'Água"],"area_tags":["Porto","Pedra d'Água"],"is_active":true,"pilot":false,"schedules":[],"source_ids":["onibus-online"],"verified_at":null},{"schema":1,"id":120,"code":"120-ayrton-senna-roberto-silvares","short":"120","name":"Ayrton Senna / Roberto Silvares","terminals":["Ayrton Senna","Roberto Silvares"],"area_tags":["Ayrton Senna","Roberto Silvares"],"is_active":true,"pilot":false,"schedules":[],"source_ids":["onibus-online"],"verified_at":null},{"schema":1,"id":701,"code":"701-guriri-via-beira-mar","short":"701","name":"Guriri via Beira Mar","terminals":["Guriri","Beira Mar"],"area_tags":["Guriri","Beira Mar"],"is_active":true,"pilot":false,"schedules":[],"source_ids":["onibus-online"],"verified_at":null}]