{
  "schema": 1,
  "id": 62,
  "code": "62-guriri-ifes-ufes",
  "short": "62",
  "name": "Guriri / IFES / UFES",
  "terminals": [
    "Guriri",
    "IFES / UFES"
  ],
  "area_tags": [
    "Guriri",
    "IFES / UFES"
  ],
  "is_active": true,
  "pilot": true,
  "schedules": [
    {
      "day_type": "weekday",
      "origin": "Guriri",
      "times": [
        "06:00",
        "07:40",
        "11:40",
        "12:10",
        "12:15",
        "13:30",
        "17:20"
      ]
    },
    {
      "day_type": "weekday",
      "origin": "IFES / UFES",
      "times": [
        "12:40",
        "16:20",
        "18:35",
        "21:00",
        "22:40"
      ]
    }
  ],
  "source_ids": [
    "onibus-online"
  ],
  "verified_at": null
}
