{
  "schema": 1,
  "id": 21,
  "code": "21-santo-antonio-aviacao",
  "short": "21",
  "name": "Santo Antônio / Aviação",
  "terminals": [
    "Santo Antônio",
    "Aviação"
  ],
  "area_tags": [
    "Santo Antônio",
    "Aviação"
  ],
  "is_active": true,
  "pilot": false,
  "schedules": [],
  "source_ids": [
    "onibus-online"
  ],
  "verified_at": null
}
